{"schemaVersion":"1.0.0","decisionId":"decision-001","incidentId":"incident-010","targetId":"target-fixture-001","policyHash":"0xabc123","policyVersion":1,"ruleId":"PROVIDER_COMPROMISE_V1","affectedResource":"provider-a-endpoint","evidenceHash":"0xeaf001","reporter":"0x5555555555555555555555555555555555555555","outcome":"CONFIRMED","conditionCode":"PROVIDER_COMPROMISE_INDICATORS_PRESENT","reasonCodes":["incident-010-provider-a-compromise"],"judgeModule":"0x4444444444444444444444444444444444444444","judgeVersion":1,"decisionStage":"PROVISIONAL","generatedAt":"2026-09-01T00:05:00Z"}
