{"schemaVersion":"1.0.0","decisionId":"decision-004","incidentId":"incident-013","targetId":"target-fixture-001","policyHash":"0xabc123","policyVersion":1,"ruleId":"SERVICE_FAILURE_V1","affectedResource":"provider-a-endpoint","evidenceHash":"0xeaf004","reporter":"0x5555555555555555555555555555555555555555","outcome":"UNDETERMINED","conditionCode":"EVIDENCE_SOURCES_CONTRADICTORY","reasonCodes":["incident-013-monitor-only"],"judgeModule":"0x4444444444444444444444444444444444444444","judgeVersion":1,"decisionStage":"FINAL","generatedAt":"2026-09-01T00:10:00Z"}
